name,price,status,shipping,free_returns,items_sold
NEW MPG SPORT XL EXTRA LARGE SWEATER JACKET GRAY OVERSIZED GRAY CAR COAT,300,New (Other),1465,False,
MINI BODEN BOYS CAMO SIZE 2-3 FLEECE LINED WINTER PARKA JACKET RED GRAY,1400,Pre-Owned,1465,False,
HANNA ANDERSSON 90 3T BOYS LOT 2 PC POLO TOPS SHIRTS GREEN BLUE STRIPES,300,Pre-Owned,615,False,
"Amber & Ash Fold Over Tote Lightweight Durable Lipstick Red for 13"" Laptop Baby",3999,Brand New,885,False,
Monster Eyes School Backpack w/Laptop Slot Travel Outdoor Luminous Party Bags,999,Brand New,,False,
Men Women Bag Backpack School Travel Shoulder Rucksack Laptop Usb Charging Bag,1999,Brand New,0,True,
Unisex Anti-Theft Laptop Backpack USB Charging Port Notebook Bag Travel School,1999,Brand New,0,True,
"Men's 18"" goat leather messenger Real satchel bag genuine laptop brown briefcase",3600,New (Other),0,True,17
"THE NORTH FACE WOMEN'S JESTER LUXE COLLECTION 27L , LAPTOP BACKPACK",7999,Brand New,,False,
"Handmade Men 18"" Genuine Leather Vintage Laptop Messenger Briefcase Bag Satchel",2850,New (Other),0,True,0
Louis Vuitton I Care Laptop Briefcase ,200000,Brand New,0,False,
Nike Air Jordan 13 Retro Backpack Bookbag Lakers 9A1898-P6N Laptop Sneaker Bag,8500,Brand New,0,True,
"Laptop Bag Case With Shoulder Strap For 13""14"" 15.6'' inch HP Lenovo Asus Mac",1368,Brand New,,True,
Swiss Tech Vezio 25 Liter Unisex Laptop Backpack Charcoal Gray NWT,1688,Brand New,1100,False,
Ogio Metro Ballistic Backpack w/ Laptop Sleeve 711107 - New 2021,6499,Brand New,0,True,0
Nike Heritage 2.0 Logo Backpack Book Bag w/ Laptop Pocket Sleeve FREE SHIPPING,3595,Brand New,0,True,275
Oakley Bathroom Sink Laptop Backpack Bag Black / Silver 23L *DISPLAY MODEL* NWT,13995,Brand New,0,False,11
17inch Aluminum Hard Case Document Organizer Box Protective Laptop Briefcase,6799,Brand New,,False,0
NWT Kipling BP4361 Seoul Go Backpack Laptop Travel Bag Nylon Robot Friends Multi,8495,Brand New,,True,
Handmade Men's Genuine Leather Vintage Laptop Messenger Briefcase Bag Satchel,3100,New (Other),0,True,15
"New Men's 18"" Large Satchel Genuine Leather Messenger Briefcase Laptop Sling Bag",3300,New (Other),0,True,36
Ful Black & Blue Laptop Travel Backpack Many Pockets & Sections Clean Great Cond,3999,Pre-Owned,1200,False,
"Shoulder Satchel Canvas Leather 17"" Laptop Backpack Travel Camping Rucksack",3299,Brand New,0,True,53
Nutsac Muy Grande Laptop Bag,11500,Pre-Owned,0,False,
Reebok Backpack Ocean Laptop/ Book Sleeve H17.5” x W11.5”x D5.5”,2498,Brand New,0,True,
Men's Get Down Art Naked Woman on Bed with Laptop STUNNER Graphic T-Shirt,1699,New (Other),0,False,0
"JanSport City View Russet Red Boys Girls Backpack Bookbag 15"" Laptop Sleeve New",3131,Brand New,0,False,
State BEDFORD Canvas Backpack Navy Blue w/Red Accents 15” Laptop Bag NEW,4400,Brand New,1185,False,
Vera Bradley Laptop Bag in Sittin' in a Tree - Briefcase/Bag - Green - Birds,2299,Pre-Owned,450,True,
"18"" Mens Briefcase Real Goat Leather Vintage Brown Messenger Shoulder Laptop Bag",3300,New (Other),0,True,21
goat Genuine Leather Large Men's Vintage Backpack Travel Rucksack Laptop Gym Bag,3400,New (Other),0,True,8
"Moleskine Classic Prussian Blue Bag/Laptop/Backpack/Holds Devices Up To 15""/NWT!",6500,Brand New,0,False,
Adidas by Stella McCartney Iconic Gym Bag Tote Backpack w Shoe & Laptop holder,5999,Brand New,0,True,0
Vera Bradley Laptop Sleeve Messenger Bag w/Strap in Portobello Road Print,3999,Pre-Owned,1500,False,
Authentic Coach Beekman Black Leather Unisex Briefcase Messenger Laptop Bag ,4900,Pre-Owned,1795,False,
Cole Haan Zerogrand Shoulder Bag Laptop Bag,6600,Pre-Owned,3187,False,
NWT Kenneth Cole Reaction Laptop Backpack MSRP $240,9499,Brand New,0,True,
"Large Men's Backpack (Blue) Travel, School, College, fits up to 17.3 inch Laptop",999,Brand New,950,False,
Men's Leather Shoulder Messenger Bags Business Work Bag Laptop Briefcase Handbag,3299,Brand New,0,True,
"Ogio Excelsior Backpack Back Pack w/ 17"" Laptop Sleeve - New - Pick a Color",4995,Brand New,0,True,0
"Space Jam, A New Legacy Tune Squad 17” Backpack, Laptop Sleeve, Reflective, NWT.",1699,Brand New,0,False,
KATE SPADE LAPTOP BAG SPENCER DOME UNIVERSAL:NWT SERENE PINK  CROSSBODY,25995,Brand New,1720,False,
Oakley SI Tactical Field Gear Bag Desert Tan Laptop Messenger Crossbody Pack,28900,Pre-Owned,1580,True,
"Nike Air Jordan Ele-mentary Backpack for 15"" Laptop Black Gray Elephant New ",5500,Brand New,0,False,0
"OGIO Rogue Pack 17"" Laptop Backpack - Choose a Color",4995,Brand New,0,True,
KATE SPADE CARA  LARGE TOTE SHOULDER BAG LAPTOP CARRYALL TAN BEIGE TUSK LEATHER,13799,Brand New,0,True,
NEW Glass Ladder Co. MEGAN Portfolio Clutch Laptop Organizer Case Blush Pink,4499,New (Other),998,False,
Vintage Military Messenger Shoulder Bag Paratrooper Stonewashed School Laptop,2499,Brand New,0,True,55
New Factory Sealed-Vaschy Lightweight Backpack For Men And Women. Laptop Sleeve,1999,Brand New,,False,0
Mens Laptop Backpack With USB Charging Port Travel Shoulder Notebook School Bag,2199,Brand New,0,True,
"Banuce Women's Full Grain Leather Briefcase 14"" Laptop Attache Case Tote Handbag",4950,Pre-Owned,999,False,
Vtg Patagonia Messenger Vertical Mass Laptop Shoulder Bag Terracotta Orange,2495,Pre-Owned,1095,False,
Men's Large Genuine Leather Briefcase Messenger Satchel Office Laptop Unisex Bag,4600,New (Other),0,True,0
New Men's Genuine Vintage Brown Leather Messenger Shoulder Laptop Bag computer,7000,New (Other),0,True,
,,,,False,
Real genuine men's leather backpack bag satchel briefcase laptop brown vintage,4250,New (Other),0,True,0
"Large Men's 22"" Top-Quality Vintage Leather Backpack Travel Rucksack Laptop Bag",3600,New (Other),0,True,26
"Mens Oxford School Backpack Satchel Laptop Notebook Zipper Casual Travel Bag 16""",2840,Brand New,0,False,
Men's & Women's Bags Vintage Leather Messenger Laptop Briefcase Satchel Unisex ,3800,New (Other),0,True,
Floral Laptop Backpack USB RFID Large Stylish School Travel Work Gift for Women,4599,Brand New,0,True,
"Leather Messenger Shoulder Laptop Men's Briefcase Satchel 18"" Very Stylish Goat ",3600,New (Other),0,True,
Michael Kors Jet Set Travel Large Commuter Tote Black MK Signature Laptop Bag,13900,Brand New,1795,True,
ADIDAS HERMOSA II MESH Backpack Student School Laptop Prime Pink,2999,Brand New,0,False,
Mercedes Benz Black canvas Laptop Backpack ,6500,Brand New,875,True,
Tumi Nappa Leather Expandable Messenger Laptop Briefcase Bag 96041-D4,5999,Pre-Owned,1699,False,
Space Jam 17” Looney Tunes Backpack With Laptop Sleeve 2021 Book Bag New Design,2222,Brand New,0,False,
"New Men's high-quality 18"" Backpack Vintage leather shoulder Rucksack Laptop Bag",4900,New (Other),0,True,
"THE NORTH FACE WOMEN'S JESTER 27L, LAPTOP BACKPACK (NEW TAUPE GREEN)",7999,Brand New,,False,
Multifunction Waterproof Travel Lightweight Backpack Shoulder Laptop Bag 35L US,2564,Brand New,,True,
"Large 18"" Men's Hand-Crafted Briefcase Real Leather Satchel Messenger Laptop Bag",3500,New (Other),0,True,
"18"" Messenger Laptop Satchel Shoulder Bag Men's Vintage Brown Genuine Leather",3990,New (Other),0,True,7
"18"" Men's Top-Quality Messenger Genuine Vintage Leather Satchel Laptop Sling Bag",2900,New (Other),0,True,0
HERSCHEL SUPPLY CO Little America Backpack Standard Laptop Sleeve Houndstooth ,999,Pre-Owned,2435,False,
"UNISEX 18"" Briefcase Genuine Vintage Leather Brown Messenger Shoulder Laptop Bag",4900,New (Other),0,True,9
Adidas Classic 3S III Laptop Backpack BLACK - NWT,3299,Brand New,799,True,0
"THE NORTH FACE WOMEN'S BOREALIS 28L, 15'' LAPTOP BACKPACK (UTILITY BROWN/VINTAGE",9900,Brand New,,False,
KATE SPADE Staci Large Leather Laptop Tote Shoulder Bag Beige Multi Colorblock,16900,Brand New,1898,False,
"UNDER ARMOUR HUSTLE BACKPACK, RED, XSTORM, PADDED LAPTOP SLEEVE 1306060 ",3595,Brand New,0,False,
Smatree Laptop Backpack for Men Business Travel Laptop Backpack 16 inch,16500,Brand New,1299,False,
Adidas 25.5L Backpack A300 Computer Padded Laptop Sleeve School Bookbag 20x13x6,4956,Brand New,1490,False,
Vera Bradley English Meadow 17” Laptop Case New With Tags- MSRP $45,2999,Brand New,1065,False,
Nike Sportswear Essentials Black Backpack BA6143-010 Laptop Sleeve With Bonus!,5995,Brand New,0,False,0
Timbuk2 Laptop Messenger Bag Commute 16” NEW with Tags,4500,Brand New,1500,False,
"3 X BREAST CANCER AWARENESS PINK RIBBON 6"" VINYL DECAL STICKER CAR TRUCK LAPTOP",275,Brand New,,False,
Women Genuine Vintage Brown Leather Messenger Bag Shoulder Laptop Bag Briefcase,3450,New (Other),0,True,
"NWT Under Armour Hustle 4.0 Storm School Sports Backpack Laptop Book Bag, Blue",3695,Brand New,0,True,0
🎁 NWT LeSportsac Gabrielle Box Backpack in Melon Laptop Compartment $125,3900,Brand New,900,False,0
CHAMPION Black Catalyst Backpack 4 Zippered Pockets-Padded for Laptop *READ,2886,New (Other),0,True,
"THE NORTH FACE JESTER 27L, LAPTOP BACKPACK (EVERGREEN/TNF BLACK)",7999,Brand New,,False,
MARCELLO Laptop Backpack Business Travel Rucksack School Tote USB Charging Port,1942,Brand New,0,True,
"New Men's 18"" Large Brown Briefcase Genuine Leather Satchel Laptop Messenger Bag",3500,New (Other),0,True,0
Vera Bradley Computer Laptop Zippered Quilted Padded Case 12x17 Fuchsia Paisley,1750,Pre-Owned,625,False,
Travel Backpack Anti-theft School Laptop For Women Men Zipper Closure 14 Inches,4761,Brand New,0,True,
New Men's Brown Leather Handbag Briefcase Office Laptop Messenger Shoulder Bag,3100,New (Other),0,True,
Men's Genuine Vintage Brown Leather Messenger Bag Shoulder Laptop Bag Briefcase,5800,New (Other),0,True,0
Men's Leather Shoulder Messenger Laptop Bags Business Work Bag Handbag Briefcase,3299,Brand New,0,True,
MICHAEL KORS GILLY LARGE DRAWSTRING ZIP TOTE SHOULDER BAG LAPTOP SIGNATURE BROWN,16999,Brand New,0,True,0
RAZER Laptop Video Gaming T-shirt,1995,New (Other),510,False,
Carhartt Foundry Series Backpack Laptop Sleeve Bag Rain Defender Water Repellent,8000,Brand New,0,True,
"Hester van Eeghen laptop, satchel, backpack",7900,Pre-Owned,2115,False,
Kenneth Cole Reaction Laptop Work Tote Bag Black,2000,Pre-Owned,1465,False,
KNOMO Laptop Briefcase Crossbody Messenger Leather Bag Travel Pockets,3999,Pre-Owned,1324,False,
NWT TUMI Northlake Expansion Messenger Laptop Bag black 069372HKO Nylon NICE!!!,16995,Brand New,2415,False,0
Tutilo Black Red Padded pocked laptop table shoulder bag 15inx 11in,3599,Pre-Owned,1000,False,
Ogio Sector Z Black Gray Laptop Book Bag Back Pack Chest Strap.,2120,Pre-Owned,1465,False,
"THE NORTH FACE SURGE 31L,15'' LAPTOP BACKPACK DAYPACK ( SCARAB GREEN/TNF BLACK )",12900,Brand New,,False,
Polyester Laptop Backpack for Women School Bag 16” USB Port Anti-Theft Work Gift,4290,Brand New,0,True,
USL Vintage Black Leather Laptop Briefcase Case Messenger Bag Expandable ,4999,Pre-Owned,2101,False,
NEW TUMI Expandable Organizer Laptop Brief Alpha 3 BLACK CHROME  STUNNING $625,39900,New (Other),1584,False,
Alpine Swiss Conrad Messenger Bag 15.6 Inch Laptop Briefcase with Tablet Sleeve,3999,Brand New,,False,92
TIMBUK2  Hacker Style Messenger Shoulder Bag Fits 13” Laptop Blue Nylon Bicycle,3999,Pre-Owned,1015,False,
MICHAEL KORS GILLY LARGE DRAWSTRING ZIP TOTE BAG LAPTOP VANILLA LOGO LEATHER,16999,Brand New,0,True,0
New Coach Mollie Leather Tote Black True Red Laptop 1671,21800,Brand New,,False,0
Columbia Sun Pass II Backpack 821.7oz Camo 15” Laptop School College,3499,Brand New,0,False,0
NWT ZAC POSEN MAXI DRESS SIZE 10 MAGENTA PRINT SAFETY PIN SWEETHEART OPEN BACK,4400,Brand New,1465,False,
Diesel Laptops Hat - New - Trucker Mesh Back Snap Back - Stylish!,899,New (Other),625,False,
Dango P02 PIONEER TRAVEL Wallet (Made in USA) - Pen Bundles available,9900,Brand New,800,True,
"Men's 18"" goat leather messenger Real satchel bag genuine brown laptop briefcase",3800,New (Other),0,True,
"18"" Men's Handcrafted Messenger Genuine Brown Vintage Leather Satchel Laptop Bag",2950,New (Other),0,True,0
,,,,False,
Large Backpack Top-Quality Genuine Vintage Leather Rucksack Travel Laptop Bag,4100,New (Other),0,True,0
Mens Leather Laptop Backpack Shoulder Messenger Bag Rucksack Sling Bag Vintage,4680,New (Other),0,False,0
LEATHER BRIEFCASE LAPTOP BAG MENS BROWN BUSINESS GENUINE MADE IN ITALY NEW ,26700,Brand New,0,False,0
Women Faux Leather Briefcase Laptop Handbag Satchel Bag Business Work Purse ,3599,Brand New,0,False,
Dango P02 PIONEER TRAVEL Wallet (Made in USA) - Pen Bundles available,9900,Brand New,800,True,
 Handmade Men's Genuine Leather Vintage Laptop Messenger Briefcase Bag Satchel,3588,Brand New,0,False,84
Space Jam 17” Looney Tunes Backpack With Laptop Sleeve 2021 Book Bag,2222,Brand New,0,False,
"Trans JanSport Large Supermax Laptop Backpack Vivid Lilac Purple NWT 17"" Beach",1895,Brand New,945,False,0
"Trans by JanSport Supermax 17"" Backpack Navy Blue Laptop Sleeve",2099,Brand New,1099,False,
KINGSONS Mens Laptop Backpack Travel Tote Anti-Theft Port Waterproof USB Charge,3773,Brand New,0,True,
Timbuk2 D-Lux Messenger Medium Black Laptop Commuter Bag Foam Padded Reflective ,8900,Pre-Owned,1499,False,
Men's Leather Backpack Shoulder Bag Weekender Travel School Laptop Bags Daypack,3299,Brand New,0,True,137
Kenneth Cole Reaction Contour Laptop Backpack Black NEW! ,1199,Brand New,800,False,
"Leather Messenger Shoulder Laptop Men's Briefcase Satchel 18"" Very Stylish Goat ",3600,New (Other),0,True,
Backpack Leather Vintage Bag Rucksack Laptop Men's Genuine Travel Satchel New ,4700,New (Other),0,True,
HANDMADE MESSENGER Genuine Brown Leather Vintage Mens Laptop Computer Bag BAG,3956,New (Other),0,False,0
"18"" New Leather Handbag Men Shoulder Messenger Briefcase Business Big Laptop Bag",5800,New (Other),0,True,
Laptop Messenger Shoulder Bag for MacBook Pro 16 A2141 15 15.6 inch Briefcase,1368,Brand New,0,True,
"Handmade 22"" Large Backpack Genuine Vintage Leather Laptop Rucksack Travel Bag",3050,New (Other),0,True,13
"JanSport 15"" Laptop Sleeve Blue T17C9RW NEW!!",1495,Brand New,0,False,0
Roblox 17 inch back pack padded adjustable shoulder straps laptop sleeve,1298,Brand New,1270,False,
Vera Bradley Satchel purse laptop bag in retired  Cuban Tiles,3500,Pre-Owned,2115,False,
Vera Bradley Laptop computer Messenger Bag in Lemon Parfait,3500,Pre-Owned,1500,False,
"Full Grain Leather Briefcase for Men 17.3"" Laptop Bag Shoulder Bag Work Handbag",13990,Brand New,0,True,106
"NWT The North Face Surge(Laptop Approved), Hot Shot, Base & Kaban Backpack",6690,Brand New,2195,False,0
Leather Messenger Bag for Men 15.6x17.3 Laptop Bag,3999,Brand New,0,True,
Fossil Computer Laptop brown  canvas leather bag - missing shoulder strap,5500,Pre-Owned,0,False,
"NWT Kipling KI1159 Seoul Backpack 15"" Laptop School Nylon Pink Blue Mix Block",8495,Brand New,,True,0
New Men's Large Real Vintage Leather Backpack Brown Travel Rucksack Laptop Bag,8000,New (Other),0,True,0
Mens Genuine Vintage Leather Satchel Messenger Man Handbag Laptop Briefcase Bag,4680,New (Other),0,True,
 18in Large Vintage Leather Bag for Laptop - Brown. Pre-Owned!,2390,Pre-Owned,1795,False,
Rare J.Crew Laptop Shoulder Messenger Camo Military Grade Cotton/Leather Bag NWT,3499,Brand New,1450,False,
Kenneth Cole Strap replacement Briefcase Travel Bag Laptop Case Bag Duffle Bag ,1495,New (Other),325,False,0
Under Armour 1342651 UA Hustle 4.0 Storm Backpack School Laptop Book Bag $55 NWT,2999,Brand New,1244,False,0
Warner Bros. beige/brown satchel messenger laptop bag Desden,2297,Pre-Owned,800,False,
Air Jordan Retro 12 XII Laptop Backpack Black/Gym Red/Grey [9A1773-KR5]Free Ship,6695,Brand New,0,False,
New Kate Spade Staci Laptop Tote Saffiano Leather Ditsy Buds Black multi ,16500,Brand New,2435,False,
Kate Spade Women’s Spencer Leather 15 inch Laptop Large Work Tote Crossbody Blue,23800,Brand New,0,True,
Clearance Sale GREEN backpack High School Travel Laptop Rucksack Zipper Bag NEW,1695,Brand New,0,False,
CoolBELL Laptop Bag Convertible Backpack Messenger Bag Shoulder Handbag 15.6 in,3999,Brand New,0,False,
Shoulder Strap Replacement For  Briefcase Travel Bag Laptop Messenger Duffle Bag,1285,Brand New,325,False,0
"13"" Laptop Backpack Anti Theft Casual Bag Fashion Backpack Lightweight Unisex",3299,Brand New,0,True,
NIXON Backpack Rucksack Large Laptop Pocket Padded Back Clip Buckle Flap Closure,4046,Brand New,2022,False,
Sovrano LG Laptop Locking Briefcase Bag Black Nylon Case NEW,4000,Brand New,1831,True,
Travel Bag 15.6” USB Laptop Bag Waterproof School Duffel Bag Blue Carry-on Bag,6899,Brand New,0,True,
New MYTAGALONGS Black Vixen Backpack Velour With Gold Hardware Laptop Bag,2000,Brand New,600,False,
"Original Oneplus Explorer Backpack 15.0"" Laptop Macbook Air Travel Bag Briefcase",7499,Brand New,799,False,53
"""LONGABERGER"" Logo Quilted Purse Laptop Travel Tote Bee Bag ",1500,,1200,False,
SKULL ARMOUR - Backpack +  Laptop Pocket - 28L,2905,Brand New,995,False,
Women Laptop Backpack 15.6’’ EVA Protection RFID Anti Theft Large Travel Work,5999,Brand New,0,True,
Johnston & Murphy XC4 Mens Business Laptop Backpack,22900,Brand New,0,False,
Franklin Covey Green Leather Tote Handbag Laptop Shoulder Bag Womens Travel,4977,Pre-Owned,2115,True,
hand-crafted Men's Backpack vintage Genuine Leather Rucksack Laptop Travel Bag,9000,New (Other),0,True,
40L Flight Approved Compressible Backpack fits for 17 in Laptop Anti-Theft,5499,Brand New,0,False,
Vintage Samsonite Leather Shoulder Laptop Briefcase,5500,,1795,False,
GIORGIO Beverly Hills Black Leather Logo BRIEFCASE Laptop Messenger Bag FINE Cnd,9999,Pre-Owned,2115,False,
"Benrus 19"" Rucksack Drawstring Bag with 16"" Laptop Pocket - Sangria",3299,Brand New,0,True,
Vegan Leather Woven Convertible Backpack Bag Tan Laptop Bag Left Coast ,1898,Brand New,895,False,
Jansport Messenger Laptop Shoulder bag Brown/pink/beige multicolor patter  16x13,3900,Brand New,1185,False,
"New Marvel Backpack - Adjustable Straps, Laptop Sleeve, 50 lb. cap.- Awesome !!!",1295,Brand New,1154,False,
And1 Black & Gray Backpack/Book BaG Zip Pockets Laptop Sleeve Basketball 18” NWT,1899,Brand New,599,False,
Tumi Clayton Rucksack Laptop Nylon Backpack BookBag Bag,24900,Brand New,0,True,0
Unisex Anti-Theft Backpack Laptop Travel Large School Bag W/ USB Charging Port,926,Brand New,0,True,
Alpine Swiss Genuine Leather 15.6” Laptop Briefcase Flap Over Messenger Bag,4999,Brand New,,False,
,,,,False,
"Kipling Ladies Large Tile Purple Nylon 15"" Laptop Sleeve AC-8205",4699,Brand New,0,False,0
Bag Leather Genuine Laptop Men's Vintage Travel Messenger Satchel Men Briefcase ,4200,New (Other),0,True,0
MVA Men Leather Shoulder Messenger Bags Business Work Laptop Handbag Briefcase,1601,Brand New,0,True,
"Travelers Club TPRC Sport 18"" Laptop Computer Business Travel Backpack Blue",2399,Brand New,0,True,
Naruto Shippuden Uzumaki Naruto & Uchiha Sasuke Print Laptop Backpack Multi-Col,6498,Brand New,0,False,
New Men's Vintage Brown USA Made Leather Messenger Laptop Satchel Shoulder Bag,3441,New (Other),0,True,0
Belkin F8N052 Sling Bag for 15.4” laptops Chocolate Brown Blue Trim & Pouch,3600,Pre-Owned,800,False,
"NEW Trans by JanSport 17"" SuperMax Backpack w/ 15"" Laptop Sleeve - Rainbow Dot ",1850,Brand New,0,False,47
Men's Leather Backpack Shoulder Bag Weekender Travel School Laptop Bags Daypack,3219,Brand New,0,False,165
Men's Tactical Sling Shoulder  Outdoor 14'' Laptop Messenger Military Travel Bag,2155,Brand New,99,True,43
KAUKKO Brand Design Canvas Vintage Laptop Backpack School Bag Travel Rucksack US,2899,Brand New,199,True,33
TUMI Laptop Sleeve Black Bag Travel 15 Inch PERFECT CONDITION,3500,Pre-Owned,705,False,
Nike Air Jordan Flight Backpack with Laptop Storage Germain Blue 9A0174-B47,3499,Brand New,997,False,0
"Men Leather Briefcase Shoulder Messenger Bag 17"" Laptop Case Handbag Travel Bag ",15900,Brand New,0,False,
Bag Vintage Leather Laptop Messenger Men Satchel S Briefcase Business Mens Bag,5299,New (Other),0,True,
Leather Laptop Messenger Briefcase Bag Satchel 11/13/15/16/17/18 Inch Men's Real,3290,New (Other),0,False,0
"Vintage Men Leather Briefcase Travel 17"" Laptop Shoulder Messenger Bag Satchel",14800,Brand New,0,True,0
Coach F71433 Men CGC Holdall Gun Metal Tote Bag Laptop Weekend Leather Black,19999,Pre-Owned,2435,False,
Real genuine leather Vintage Back pack laptop satchel brown vintage handmade bag,4928,New (Other),0,False,
Tumi 15 inch Laptop Briefcase Shoulder Bag Nylon Black Excellent Condition,3500,Pre-Owned,1425,False,
NEW MAXON COLLECTION DARK BROWN CREAM PEBBLE LEATHER ITALIAN🇮🇹BACKPACK🎒LAPTOP,13500,Brand New,1999,False,
"Men's Real Leather 17"" Laptop Bag Backpack Large Hiking Travel Camping Carry On",14900,Brand New,0,True,0
Michael Kors Large Tote Black Leather Laptop Bag Handbag Purse Shoulder,14400,Brand New,1695,True,
New With Tags Under Armour Hustle UA Storm 3.0 Backpack Laptop School Bag,4323,Brand New,0,False,200
LL Bean Camo Backpack Rucksack Book Bag Multi Pockets Laptop Travel Bag Medium,2900,Pre-Owned,1425,True,
Vera Bradley Floral Print Laptop Case with Removable Straps BARELY USED,2500,Pre-Owned,1595,False,
ibagbar Canvas Laptop Messenger Bags 14 Inch Crossbody Shoulder Bag Computer Bag,3800,Brand New,,False,
Pink Briefcase Laptop Messenger Bag Shoulder Water-Resistant Direct Sellers NEW,2477,New (Other),1270,False,
New US Men Leather Backpack Soft School Laptop Notebook Travel Bag,4740,New (Other),0,False,
Leather Laptop Bag's Briefcase Women New Business Womens Handbag Tote Purse Work,3254,New (Other),0,True,
"Embark 19"" Black Jartop Laptop Nylon Backpack School Travel Work Bag Pockets ",2490,Pre-Owned,1595,False,
Coach F1373-F23268 Black has padded divider carryall EUC leather laptop/tablet,5688,Pre-Owned,1185,False,
Johnston & Murphy Rhodes Leather Laptop Business Backpack,25900,Brand New,0,False,
"Innturt Large Sling Bag Backpack Pack 13"" 14"" Laptop Bag Satchel School Travel",3129,Brand New,0,True,
2021 New LOL Surprise Backpack 17” Laptop Sleeve And Pockets Purple White Shiny,1999,Brand New,1465,False,
"Two Lumps of Sugar Laptop Bag Blue Red White Gray Plaid, Padded Carrying Bag",2099,Pre-Owned,880,False,
2021 Under Armour Hustle UA Storm Backpack Laptop School Bag,2999,New (Other),0,False,0
Women Laptop Backpack 15.6’’ Travel Work Laptop Comprtment Sleeve WaterResistant,4999,Brand New,0,True,
Bag Leather Shoulder Laptop Messenger Business Briefcase Men Men's Genuine New,4700,New (Other),0,True,
Bag Messenger Leather Shoulder Laptop Briefcase Men's Genuine Satchel Men New,4700,New (Other),0,True,
"JanSport City View Russet Red Boys Girls Backpack Bookbag 15"" Laptop Sleeve New",2999,Brand New,0,True,
JoJo's Bizarre Adventure Team Bucciarati Characters Laptop Backpack Multi-Color,6498,Brand New,0,False,
"Men Women 15.6"" Laptop Backpack Large USB Charging Travel Waterproof School Bag",1999,Brand New,0,False,
Mens Messenger Bag Waterproof Satchel Crossbody Computer Laptop Shoulder Bag New,1499,Brand New,0,True,0
Naruto Hatake Kakashi Jonin Gear Inspired Laptop Backpack Multi-Color,9498,Brand New,0,False,
OSPREY Elroy Laptop Shoulder Messenger Bag Orange,4999,Pre-Owned,699,False,
Kipling SEOUL Backpack w/ Laptop Protection True Blue Navy Medium  Size NEW Tags,3999,Brand New,799,False,
New Authentic Vineyard Vines Pink Whale Sticker Laptop Yeti Car Decal,285,New (Other),0,False,235
Timbuk2 Command Laptop Messenger Bag Black Medium NYC Limited Edition,9995,Brand New,0,False,
Coach Addison Textured Brown Spectator Leather Laptop /Tote Bag 13207,14999,Pre-Owned,0,False,
ECOSUSI  Faux Leather Laptop Bag /Crossbody/Messenger Bag Navy Blue NwT,2800,Brand New,2661,False,
Genuine Men's Gucci Snap Flap Messenger Lap Top Bag Beige Coated Canvas Leather,55174,Pre-Owned,3373,False,
Nike Air Jordan 13 Retro Flu White Purple Lakers Laptop Backpack ,9999,Brand New,0,False,
Wxnow Women Laptop Shoulder Messenger Bag Handbag Briefcase Canvas Laptop Sle...,3634,Brand New,0,True,0
The North Face Purple Borealis Backpack Laptop Pocket School Travel Hike Camp,3999,Pre-Owned,1150,False,
Clearance Sale Gray Travel Backpack Rucksack Laptop School ,1695,Brand New,0,False,
"Used Men's PU Leather Business/College Laptop Handbag/Bag 17"" x 12"" x 4"" Black",2099,Pre-Owned,0,False,
"Used Men's Leather Business/College Laptop Handbag/Bag 17"" x 12"" x 5"" Black",1999,Pre-Owned,0,False,
Men's Genuine Vintage Leather Satchel Messenger Man Laptop Briefcase Bag,4930,Brand New,0,True,0
Anti-theft Backpack Business College Student School Laptop Bag USB Charge Port,1133,Brand New,0,True,
Dakine Trek 26L Laptop Backpack Tradesman New,6495,Brand New,0,True,
KINGSONS Mens Laptop Backpack Travel Bag Anti-Theft USB Charge Port Waterproof,3791,Brand New,0,True,
Bag Laptop Leather Messenger Briefcase Men's Satchel Shoulder Genuine Vintage ,4700,New (Other),0,True,
Bag Leather Briefcase Messenger Laptop Satchel Genuine Shoulder Mens Men Vintage,4700,New (Other),0,True,
